label,text
5,lpt buy industrial amp commercial appliances for your home whenever possible they will save you a lot of headaches i
5,lpt ask for advice even if you re doing fine there are always people that know more than you do
5,lpt track what companies are selling your data by adding the company name to your email address add name of
5,lpt just like you don t need to compare yourself to people that might be better off you really shouldn t compare yourself to people in a worse position take care of yourself there will always be someone better or worse than where you re at
5,lpt stretch stetch if you tense up it helps
5,lpt if you re trying to explain net neutrality to someone who doesn t understand compare it to the possibility of the phone company charging you more for calling certain family members or businesses
5,lpt use olive oil to remove surgical tape without pain dab olive oil on the parts of tape sticking to
5,lpt do not overrate envy the one who seems to be doing well in all things the truth is everyone is struggling at some points we don t have the same problems and everyone is trying to figure it out
5,lpt eat the watermelon seeds they are edible and nutritious and make eating watermelon so much more enjoyable when you
5,lpt always treat your career and education as a circle instead of steps if you have to have a more successful meaningful life
5,lpt are some buttons not working within mobile apps? turn off your blue light filter app because it s interfering
5,lpt when starting your career job hopping is the best way to increase your salary don t wait for a raise as the increase is very small apply to other jobs get an offer and leverage your offer to get a higher salary companies don t care about your company loyalty it helps only the company
5,lpt you can filter youtube and google searches to have a minimum age as well as a maximum if you
6,me 20f having a quite low self esteem on my body hesitate meeting a guy 23m from online i started
6,when to call it quits? some background me 21f and my long distance boyfriend 24m have been together through
6,girlfriend refuses to let me sleep hello i 20m have a girlfriend 19f and we have been together for over
6,husband mid life crisis my husband of 10 years is turning 40 and is having a midlife crisis all of
6,m30 my first sex with a guy m35 ended up with me having a panic attack there reason i m
6,my girlfriend watches a youtuber with concerning content what should i do? my girlfriend knows spanish and watches a
6,i 39m found notifications on my gfs 38f phone for several dating sites we have been dating 3 5 years
6,update i 16f texted my sister 22f pictures of the romantic letters her boyfriend 37m wrote to our mom he called me from her phone and flipped out on me
6,my bf 25 said he s content chilling with me 24f basically no sex we use to be active a
6,ex? gf accusing me of cheating on her i m22 dated my ex gf f23 for about 10 months
6,i kinda broke my relationship with my best friend over miscommunication my best friend and i have a special relationship
6,update original post here https www reddit com r relationship advice comments o12fnx my 31f husband 30m turned out to
6,a girl that i m talking to talks to me about other guys that she is talking to seeing as well
6,i 24m accidentally walked in on my brother 17m kissing another boy and now he won t talk to me
6,she writes me often first comforts me amazing when im doiwn but we suck at normal conversations should i worry about it?
6,i ended my engagement 3 years ago because i found out my ex lied about his age i want to
6,went down on a girl and ended up throwing up need as much advice as possible ive got no idea
6,post breakup need an urgent advice f 24 hi guys so me amp my bf 22 of one and a
6,i ve temporarily cut contact with my mom but now i m not sure how to continue i 19 moved
6,my sister wants work for free tdlr my little sister wants me to design and build her home but doesn
6,sister being way too sensitive and a hypocrite i m f17 and my sister is f26 she was asking me
6,is it worth getting my gf back about a month ago me and my girl split up it was really
6,i just found out my mom cheated on my dad i m 21 years old my parents divorced when i
6,feeling weird celebrating my birthday alone but hey here s to being 25 today i hope you guys have a
6,am i expecting too much from my partner? my partner and i both well over 30 have had a
6,i am meeting a tinder match after 4 months can we share a hotel room? so i am a
6,husband 25m gave almost all of our money to help someone without telling me 25f basically what the title says
6,my bf wants me to delete instagram i ve been with my bf 2 5yrs he now thinks i m
6,are they toxic or overprotective? my parents were always overprotective about me as i was their first child i
6,should i ask to sit near him? this is going to be pretty pathetic so bear with me i
6,gf 23 cheated and gave me 23m chlamydia then accused me of cheating she is now telling other people that i cheated and i don t know what to do any advice would mean a lot
6,teasing me until i don t want to have sex anymore is this normal? so as the title says
6,me 19m and girlfriend 20f in disagreement over sharing past experiences help? hi there on mobile so apologies if
6,is this a normal activity between guy friends? i ve 21f been with my bf 23m for just under
6,discovering my partner of 3 years is a loser hey guys writing to you devastated right now met my partner
6,my 26m girlfriend 24f just returned from a holiday without me where i think she cheated on me we ve
6,my mom wants nothing to with me because of my husband i am a 22 year old woman married to
6,how not to attracted crazy men or players? age 23 women i am just wondering since i did attracted
6,venting this morning not sure how to completely tell my spouse he is absolutely lazy this morning i about lost
6,gf is angry that i embarrassed her during a couple s massage so my gf scheduled my first ever professional
6,new classmate 19m won t leave me 17f alone after i ve told him i m not interested i apologize
6,am i too needy or are we just incompatible? skip to the 4th paragraph if you don t care
6,our nice maid steals food and clothes from us what do i do? is stealing really bad when you
6,will i 27m regret not being able to look past the shitty person my dad 59m was once he s dead?
6,how should i tell my bf i m still feeling insecure? i work at a large retail store with
6,he was offended because i called him hot? i ve been talking to someone and he got pretty pissed
6,i gave my bf an engagement by a certain date ultimatum and now i regret it background info my bf
6,cheated ex girlfriend tried to make me the bad guy it s been about a month now since i broke
6,i snooped today and found something i regret today i m24 found out my gf f23 had a tik tok
6,boyfriend broke up with me and got with our future roommate my boyfriend of 9 years recently ended our relationship
6,husband and female friend hello i m one of those people who have a hard time accepting that males and
6,i don t like to split the bill it makes me feel really weird to split the bill when i
6,what in the dickens so i ve been married for almost 12 years and for the most part things have
6,my m25 fianc e f24 is insecure about her burn marks from a kitchen accident discoloration from feet to knee how can i make her know that i find her beautiful the way she is and that she doesnt have to hide it from me?
6,scared that he get pushy with sex after it sexual warning so i want to rub my partners dick through
6,gas lighting is it gender specific hey i am just looking for peoples opinions my brother got in an argument
6,my ex is dating someone who is cheating on her fiance with him im so unsure what to do and
6,boyfriend says he wouldn t care if i left him i 23f have a very good relationship with my new
6,what to do now? so my gf 20f and me 23m have been dating for just about 2 years
6,controlling in a relationshop hi all to what extent is control acceptable in a relationship? i understand everyone has
6,update my family doesn t accept my gf first off i want to thank everyone for being supportive in the
6,my boyfriend is petrified of doctors and dentists my 26f partner 32m of around 6 years has a massive fear
6,i 20 f female found something i shouldn t have in my 23 m boyfriends reddit comments so my boyfriend
6,i m afraid of being in a relationship with a man i m attracted to men and there have been
6,my 27f husband 35m bought a new car that increased his car payment even though he can t pay his bills without working overtime
6,i 32m feeling unloved with my fianc 32f of 12 yrs nsfw tldr i 32m feeling unloved deadbedroom with my
6,constantly impressed with my friend s performance in situations i have known this person for a few years and am
6,my fundamentalist christian cousin told me i m judas in the bible i am going to hell all while i m helping his dying mother get to cancer treatments
6,i 33m broke up with my gf 35f because we had lifestyle differences was it the right decision? 2yrs
6,married life help married a few years ago because my boss and wife s parents really wanted us too they
6,my ex fianc is pissed because i am engaged less than a year after i called of the wedding the
6,my girlfriend s parents are racist i m an 18 year old male and i m black my girlfriend is
6,is it bad to open up after an argument? like you get in an argument over a miscommunication as
6,update i 25f feel like my brother 27m doesn t want me around any more due to his child free wedding should i bring this up?
6,i 22m think that i may want to break up with my girlfriend 22f but i still care about her deeply
6,girlfriend having a sexual fantasy about an older man my girlfriend 24 told me last night when watching explained on
6,should i confront my bf about him still having pictures of his ex? my bf and i have been
6,men in relationships looking lurking at other girls social media? i just want to see everyone s opinion on
6,my mother doesn t trust me and i dont think she ever has cw emotional abuse and suicide tldr my
6,my boyfriend 24m wants to have an open relationship and i 21 dont know how to handle it me and
6,should i tell my step dad the real reason i 31f no longer want to come to family gatherings? tw molestation
7,barley stripe mosaic virus b protein disrupts chloroplast antioxidant defenses to optimize viral replication
7,though hand washing is proven effective in combating spread of disease the physics behind it has rarely been studied now researchers describe a simple model that captures the mechanics of hand washing showing it does takes 20 seconds of vigorous movement to dislodge potential viruses amp bacteria
7,a new species of acetabularia mermaid like algae found from andaman and nicobar islands a single gigantic cell
7,neuro mesenchymal units control ilc 2 and obesity via a brain adipose circuit
7,russian influence in alternative us media popular sites such as zero hedge echoes russian propaganda research analyzed over 600 articles and found a strong correlation between sputnik and popular alternative media sites that can provide favorable coverage in the u s of russia and its allies
7,hyenas hoarded thousands of human animal bones in saudi arabian lava tube
7,study finds 74 of march madness attendees wore masks correctly
7,ucla led study could clarify how microbes can exacerbate cognitive decline alterations in the gut microbiota contribute to cognitive impairment induced by the ketogenic diet and hypoxia
7,scientists discover that constant loneliness increases binge eating and decreases sleep study in fruit flies
7,study shows building bonds between males leads to more offspring for chimpanzees
7,short daytime naps don t relieve sleep deprivation study finds
7,effects of a single dose of ivermectin on viral and clinical outcomes in asymptomatic sars cov 2 infected subjects a pilot clinical trial in lebanon
7,gut microbiota targeted diets modulate human immune status
7,oncotarget mtorc 1 and plk 1 inhibition in adenocarcinoma nsclc
7,study reveals missing link between high fat diet microbiota and heart disease a high fat diet disrupts the biology of the gut s inner lining and its microbial communities and promotes the production of a metabolite that may contribute to heart disease
7,vitamin d supplementation does not have beneficial effects on muscle function strength or mass according to an analysis of all available data from relevant randomized controlled clinical trials
7,2d supersolid that flows without friction has been made for the first time
7,consumers believe that products from adult coloring books to sports drinks work better for others than they do for themselves 15 studies n 6547 researchers found this bias stems from people s belief that they are unique and not as easily manipulated as others
7,inflammation induced histamine impairs the capacity of escitalopram to increase hippocampal extracellular serotonin we show decreased serotonin levels are supported by increased histamine activity because of inflammation acting on inhibitory histamine h3 heteroreceptors on serotonin terminals
7,saturn s rippling rings point to massive soupy core hidden inside
7,persistent endotheliopathy in the pathogenesis of long covid syndrome
7,a study looks at a dark sky observatory in china that will be the first in the eastern hemisphere allowing chinese scientists to peer deep into space
7,excess of covid 19 cases and deaths due to fine particulate matter exposure during the 2020 wildfires in the united states
7,scientists convert light into matter and antimatter new study confirms
7,promise of metformin for preventing age related cognitive dysfunction august 2021
7,trading of animals susceptible to bat coronaviruses is the likely cause of the covid 19 pandemic
7,ivermectin for prevention and treatment of covid 19 infection a systematic review meta analysis and trial sequential analysis to inform clinical guidelines
7,having a good listener improves your brain health for every unit of decline in brain volume a common sign of reduced cognitive function adults in their 40s and 50s with low listener availability had a cognitive age that was 4 years older than those with high listener availability
7,cities are making mammals bigger a new study shows urbanization is causing many mammal species to grow bigger possibly because of readily available food in places packed with people the finding runs counter to many scientists hypothesis that cities would trigger mammals to get smaller in time
7,a new study shows that increased microrna 31 expression is associated with hair follicle aging genetic deletion of the microrna or pharmacological inhibition of its downstream effectors suppresses hair follicle stem cell aging in mice a promising therapeutic avenue for treating skin aging
7,atogepant for the preventive treatment of migraine nejm
7,angry bees produce better venom curtin researchers find
7,new article argues researchers should not adjust their alpha level when undertaking single tests of multiple individual hypotheses
7,thresholds of temperature change for mass extinctions our findings predict that a temperature increase of 5 2 c above the pre industrial level at present rates of increase would likely result in mass extinction comparable to that of the major phanerozoic events
7,a rare disorder makes you hallucinate tiny people lilliputian hallucinations involve tiny men women children gnomes imps or dwarfs often strikingly dressed as harlequins clowns dancers soldiers peasants etc literature review suggests prevalence is 30 80 per 10 000 psychiatric patients
7,new study finds a high need for uniqueness among white people predicts less positive attitudes toward multiculturalism when their white identity is made salient majority group members made to feel nondiverse balk at the prospect of celebrating other groups diversity
7,astronomers see galaxies in ultra high definition
7,physical activity reduces clinical symptoms and restores neuroplasticity in major depression
7,researchers have successfully developed a speech neuroprosthesis that has enabled a man with severe paralysis to communicate in sentences translating signals from his brain to the vocal tract directly into words that appear as text on a screen
7,major print media in five countries have been representing climate change very factually hitting a 90 percent accuracy rate in the last 15 years scientifically accurate coverage of man made climate change is becoming less biased however research did find biased coverage in conservative media
7,researchers investigate the harmful effects of tooth whitening products on tooth cells decreased viability of tooth cells after tooth whitening exposure 2021
7,study men who were more likely to act as allies to women at their workplaces reported proportionately higher levels of personal growth and were more likely to say they acquired skills that made them better husbands fathers brothers and sons
7,research has found that the pandemic resulted in a six to eightfold increase in rates of intimate partner aggression across the u s the research is among the first to document increases in perpetration of intimate partner aggression following the onset of the pandemic in local communities
7,new research two studies n total 386 shows people who interfere in the romantic affairs of family members are more likely to be narcissistic and the ones who interfere with friends are more likely to be sadistic
7,engineers designed a soft lightweight amp potentially low cost neuroprosthetic hand amputees who tested the artificial limb performed daily activities such as zipping a suitcase pouring a carton of juice amp petting a cat just as well as or better than those with more rigid neuroprosthetics
7,blue hydrogen is worse for the climate than coal study says
7,preregistration does not improve the credibility or interpretability of research when other open science practices are available
7,dogs are genetically hardwired to understand human cooperative communicative cues ostensive and facial cues pointing
7,mit scientists reveal why water drops move faster on a hot oil coated surface
7,archaeologists unearth nazi era massacre in poland s death valley
7,ivermectin doesn t speed recovery from mild covid 19 study shows
7,volatile chemical product emissions enhance ozone and modulate urban chemistry
7,new research published in the journal of neuroscience has shown that even when math problems are spoken out loud your brain processes them completely differently from normal speech
7,staying true to yourself in a relationship leads to the best outcomes except among people who are high in psychopathy psychopathic tendencies appear to disrupt the link between authenticity and relationship well being
7,birds get angry when their favourite snacks are swapped in magic trick
7,researchers have created a lightweight prosthetic hand can grasp strawberries without crushing them and still works after being hit with a hammer or run over by a 1 5 tonne vehicle
7,higher self perceived attractiveness is associated with having a less committed partner
7,break discovered in one of the milky way s arms
7,new study shows lack of money and time management explain why lower social status university students have poorer mental health
7,science mindset or belief that logic must be used to generate testable hypotheses and that empirical evidence is imperative for understanding was a positive positive predictor of increases in covid 19 concern
7,life on earth arose multiple times and in multiple ways new theory says
7,ccr 6 expression on b cells is not required for clinical or pathological presentation of mog protein induced experimental autoimmune encephalomyelitis despite an altered germinal center response
7,eating fructose appears to alter cells in the digestive tract in a way that enables it to take in more nutrients these changes could help to explain the well known link between rising fructose consumption around the world and increased rates of obesity and certain cancers
7,mistrust and beliefs in conspiracy theories differently mediate the effects of psychological factors on propensity for covid 19 vaccine
7,new studies hint that the coronavirus may be evolving to become more airborne the virus appears to spread through the air but masks reduce the amount of infectious virus
7,a new study shows that people who walk or garden at least three to four hours per week or bike at least two to three hours per week or the equivalent after having a stroke may have a 54 lower risk of death from any cause the study found the most benefit for younger stroke survivors
7,bindin is essential for fertilization in the sea urchin
7,molecular basis for dart adp ribosylation of a dna base
7,plant communities and landform relationships delineate the components of soil complexes subject to whole tree harvest restriction
7,people assume that men use humour to make themselves look better which leads to harsher evaluations when their jokes flop the findings suggest that men are perceived more negatively for their humour mistakes than women
7,frontline workers were less distressed during pandemic than the public playing a crucial societal role during a crisis as well as helping others can help boost and protect your own mental wellbeing
7,small blobs of human brain grown in a dish have been coaxed into forming rudimentary eyes which respond to light by sending signals to the rest of the brain tissue
7,estimation of glomerular filtration rate with vs without including patient race eliminating the race coefficient was associated with a systematic error in the evaluation of african american individuals
7,green roofs may increase urban rainfall
7,study suggests that the trading of animals susceptible to bat coronaviruses is the likely cause of the covid 19 pandemic
7,the brain cells that help animals navigate in 3d
7,northern bees could thrive as the earth s climate heats up new study says
7,antibiotic novobiocin found to kill tumor cells with dna repair glitch an antibiotic developed in the 1950s and largely supplanted by newer drugs effectively targets and kills cancer cells with a common genetic defect
7,exposure to credibility enhancing displays creds predicts religious belief atheism in american adults creds are hard to fake signals of commitment to religious beliefs painful rituals like scarification martyrdom celibacy emotional displays financial donations and dietary taboos
8,spoiler i don t get the hype for stephen kings salems lot so i have a few complaints about this
8,dr seuss fans i don t understand the butter battle book i know this question sounds dumb but i can
8,historical accuracy of circe by madeline miller can some of yall help me understand how historically accurate the book is
8,alternate history books always over estimates how much a country can extend its borders granted i have only read 2
8,roger ackroyd spoilers i never believe that the author used an unreliable narrator i always place my trust in the
8,david koepp s cold storage is amazing i just read david koepp s cold storage and i thought it was
8,it s been a day since i ve finished battle royale by koushun takami wow so this book broke all
8,does anyone know the book run by gabby tye? when i visited singapore in approximately 2015 i stumbled upon
8,dune i finished dune a couple days ago easily the best book i ve ever read it s everything i
8,fevre dream by george rr martin did not finish it s really weird to say something bad about a book
8,how do you read short story collections? do you devour in one go one after the other or do you need a pallet cleanser so to speak between each?
8,black business month spotlight dc s mahogany books
8,what is the worst book you ve ever read and why? people come on here all the time to
8,has anyone else noticed a decline in the build quality of the books or am i going crazy? the
8,what time of day do you prefer reading? i recently started getting back into reading again after realising i
8,horror books are way scarier then horror movies i have doje this experiment and read salem lot snd watched the
8,hi just stopping in to say hi i have not talked in most groups i have joined yet because i
8,journal about every book you read tonight on a flight across the us i sat next to a wonderful older
8,anxious people by fredrik backman was touching throughout the novel and totally worth reading i m not sure i d
8,uk libraries that use overdrive and take non residents? hi all i ve recently bought a kobo so that
8,dnf sharks in the time of saviors? if you read this or are interested in it what did you
8,how do you pick what to read next? amp how do you manage your reading list? my reading
8,mourning for the reader i used to be hello everyone i hope this is allowed but i just wanted to
8,what to do when books make you feel things? sorry the title is so lost for words lol but
8,who was more evil in lord of flies jack or rodger? personally i believe it to be rodger even
8,i hate mukarami and don t understand the hype about him at all i don t understand the amount of
8,we are the brennan s by tracey lange i was wondering what people thought about it i saw some reviews
8,perestroika in paris by jane smiley i picked this book up on a complete whim i was heading out of
8,what makes a book an epic novel? this seems to be a hard question for me in one aspect
8,never say you can t survive author charlie jane anders on writing sci fi worth living for syfy wire
8,have you ever read a book with which you felt that there was no purpose at the end? let
8,cs lewis dedication in the lion the witch and the wardrobe is superb my dear lucy i wrote this story
8,where do you go to find older or not as popular books that are no longer in print? i
8,how different are translations really? i m latino living in canada and i ve been meaning to read more
