label,text
1,what are the various interpretations of the unique signature of matilda of tuscany? matilda of tuscany apparently often signed
1,roosevelt and petain s relationship? i ve recently heard that president roosevelt preferred french general and dictator petain to
1,considering the ongoing racial tension in the 1960s how did so many black music artists achieve significant mainstream fame?
1,why did the nsb and anton mussert specifically look to colonize the delagoa bay? i was doing some research
1,how was the future depicted in science fiction books before the 1800s? for example in 1950s 1960s fiction when
1,how common were small scale battles in feudal japan? as i understand it most battles during feudal japan for
1,why would wwii pilots switch off their radios while landing? i m reading the big show by the french
1,did bosses really just go to their employees for supper in 1950s america like in sitcoms?
1,what were the us ussr plans in case there was life on mars? i just learned that the mariner
1,in your period of focus how did militaries approach small scale engagements and what sort of tactics were employed? can you suggest references that provide topical map illustrations?
1,how long have we been colour coding politics? how far back does associating colours to political parties go?
1,historical books published using vatican archives material hello fellow historians i am doing phd in church history of lithuania i
1,how did female female friendship among social elites in late republican to early imperial rome differ from male male friendship? was there 1st century girl code and bro code? could a woman go on a spontaneous lunch date with her girlfriends as easily as her husband?
1,did the distinction between heavy and light infantry cavalry exist in history or is this a modern designation applied in hindsight?
1,what did wild west villagers sleep in? when i look at a lot of wild west towns i see
1,what was the strategic value of capturing stalingrad in late 1942?
1,i ve read that national borders drawn during decolonisation caused long term instability especially in africa and western asia how could the borders have been drawn differently to create a better outcome?
1,can someone please explain the karl marx s theory of history i m having a hard time understanding its context
1,how did the catholic church come to oppose capital punishment? throughout much of its history the roman catholic church
1,at roughly what point did christians start converting people by the sword instead of persuasion? obviously i know there
1,different years of immigration on different census s? i ve been doing ancestry research for years now and one
1,in red dead redemption 2 a character micah calls the tuberculosis ridden protagonist black lung would a 19th century outlaw really know that sick man s lungs turn black and not say purple yellow red?
1,what did the vikings think of the anglo saxons? did they view them as strong fierce warriors such as
1,why are german and frankish crusaders treated like villains while richard and saladin considered heroes? is it because the
1,did early medieval europeans accept classical learning uncritically particularly when it comes to practical topics like health medicine? would an early medieval scholar ever be confident enough to say pseudo apuleius was wrong?
1,what is the most concrete theory about heinrich muller s disappearance?
1,what was the rationale behind the demarcation of durand line by the british in the way it was done?
1,what kind of kit would a mid 15th century west highland warrior have? i m looking to make a
1,how culinarily unusual might a cheeseburger have been in 1st century rome? would a combination of minced beef cheese bread and vegetables however put together have been considered particularly out of the ordinary within roman diets?
1,what were relations like between the city of rome s 1st century jewish population and their pagan neighbours? reading
1,were far east cultures impressed by european art in the 1500s? looking at michelangelo s and his successors sculptures
1,is it possible that the afterlife in christianity is based on greek babylonian and or zoroastrian concepts of the afterlife?
1,what was life like for peasants artisans merchants and the nobility in 18th century bengal before the advent of eic rule?
1,understanding river gods in greek and roman religion hi i m looking to better understand river gods in classical hellenism
1,in the 3rd century bc crossing the alps earned hannibal an absolute madlad status in the 4 5th century ad italy and rome basically had revolving doors for those who wanted to sack them what changed?
1,during both the middle ages and the early roman period how much did people know about history? in todays
1,how was the public reaction to the polio vaccine when it first came out? did governments force people to get them without their consent? it took 5 years supposedly for the percentage necessary how was this achieved?
1,myth or truth? a story of a female russian soldier who was a pow near the end of the war she escaped the german prison camp and was able to make her way back to russian lines where she was raped for days and finally murdered
1,how did hiv aids go from a certain death sentence that killed scores upon scores in the 1980s to routinely hearing about people living comfortably with the disease for 30 years at least in the us?
1,in jarhead a marine trainee in the scout sniper program stands up during a crawling exercise and gets shot how common were such training exercise deaths from live ammunition at the time?
1,why were latin american countries historically so prone to dictatorships?
1,how did distillers distilleries preserve their yeast during prohibition?
1,how did japan develop such advanced an advanced civilization when it is a relatively small island nation with limited natural resources?
1,in early modern europe was there ever any historical figure holding progressive views by contemporary standards? for example was
1,need help with a novel i m in the process of planning out hi so as the title says i
1,vietnam expansionism? reading deng xiaoping and the transformation ot china right now and i was wondering this in china
1,how wrong were columus es calculations really? a lot of times i hear how columbus was stupid that his
1,we re confederate army officers ever reinstated into the union army after the end of the civil war? if yes how was it done and how were they treated?
1,are magyars descendants of huns? did magyars come from huns? did magyars exist before huns rule? are
1,could charles v have integrated his spanish holdings into the hre? was there a procedure to add lands to the empire?
1,what was the cultural perception of islam in the united states before 9 11?
1,in glantz s the soviet german war 1941 1945 essay he notes that total nazi losses amounted up to 13 488 000 while acknowledging only roughly 4 million are dead and 3 million plus are captured are the extra numbers just really disabled or missing don t they seem too much?
1,from the 12th to the 16th century people consumed mummies as medicine from the 17th to the 19th century people used grounded mummies as paint did anyone criticize these practices at the time?
1,the jewish temple at elephantine postdates the babylonian exile when the jews are thought to have transitioned to monotheism yet the documents found at that temple attest to polytheistic worship of yhvh and his wife anat yahu what does this reveal about the evolution of judaism?
1,why would english colonists bring ivy to america? here s an example where they attribute the presence of english
1,the home owners association seems universally disliked by everyone i talk to across generations why did it come about and why is it so ubiquitous now?
1,i want to go to my local renaissance fair as a historically accurate common man peasant where can i find detailed information about what average men wore during the reign of elizabeth i?
1,i have been told several times that chinese people practised haruspicy like romans and italians but is there any evidence for this? and if so how their ways different then the romans or italians?
1,is personality based astrology a modern phenomenon? a recent discussion with a friend kicked off an argument about whether
1,how was employment found in the soviet union? did the government assign people or did they get some choice?
1,the first triumvirate hi all i m very interested about this time period in roman history what are the best
1,history of the roman empire so hey guys i have bought the five volumes made by theodor mommsen on roman
1,why did the soviet union take such hostile action against afghanistan in the 1980s? i m reading soldiers of
1,askhistorians podcast episode 190 women in medieval warfare with u hergrim askhistorians podcast episode 190 is live https askhistorians libsyn
1,was the pre modern christian world more overtly anti semitic than the islamic world? and why if so?
1,during the american civil war why did the confederates engage in rank line infantry combat? it seems to me
1,was the liberian declaration of independence legitimate from the get go or was it not legitimate until the us recognized it?
1,leadership at different study levels and in academia hi folks as the header says i am interesting in the concept
1,were attila the hun and the medieval hun people white?
1,how would servants in inns or similiar differ from servants in homes in the early 19th century? presumably inns
1,how did the persian immortals dress? did they actually wear those cool face masks like in the movies or
1,chinese schools teach the century of humiliation to be really humiliating for china but did the rest of the world see it the same way?
1,did the duhare exist? i ve anecdotally been told about a tribe in north america with a language most
1,on the inevitability of the great war i ve heard frequently that wwi was inevitable if not for the assassination
1,i know john c calhoun believed in a white democracy but did he believe that white women and non property owning whites should participate in a white democracy?
1,in media pirates are portrayed with a eyepatch how common were eye related injuries during the golden age of piracy?
1,considering muhammad had several wives who were well educated and scholarly how did sects of islam become so hostile to educating women?
1,how did european missionaries and explorers communicate with and eventually learn the languages of indigenous tribes in polynesia and the pacific?
1,what was the general attitude of u s foreign policy makers towards germany between 1898 and 1914? was it at all positive or was it mostly negative? did it consist of outright hostility or was it more suspicion? why?
1,in chapter 62 of moby dick the dart ishmael advises that the harponeers should be rested and not row has any whaling ship taken this advice?
1,did ancient religions eg greek roman mythology egyptian mythology etc have holidays?
2,wp a petty thief was put into solitary confinement for months by order of the king one day the thief is freed by a dark elf who says i ve found you at last
2,wp a person who aspires to be an online writer makes a simple new years resolution write a story that they can feel comfortable posting to reddit they spent all year procrastinating by doing their studies and now they must finish a 3 000 word story that they haven t even started in 12 hours
2,wp as you ride your bicycle through autumnal snow an ethereal angel sat down lightly on the rear bike rack brow creased with concern want to switch the bodies back?
2,wp the irs has announced that they will deport any rude canadians back to canada and rescue polite americans back to u s you re trying to convince the irs agent that you re really a rude canadian deserving to be deported while the real canadian beside you vehemently disagree
2,wp as the hero utters the secret words the light shines music starts and their transfomation begins yet instead of the normal and expected result the hero has turned into something quite different
2,wp you ve been called for jury duty but you realize that the crime was your fault
2,wp after chanting the ancient words to summon the dark lord i was shocked instead of a demon a bespectacled old woman appeared from the firey depths of the pentagram thank you for calling the department of death where we aim to make your apocalypse slow and painful how can i help you today?
2,wp 200 years ago afraid of the threat of alien invasion humans developed a devastating weapon despite no alien invasion in the present a global war ravages the planet and threatens the human race the only solution in sight is the mysterious weapon you ve just been tasked with retrieving it
2,wp in a world where heroes usually seduce villains in undercover operations you have learned to pay no mind to people who hit on you one day you re tired of it all and walk up to your favourite bar and strike a conversation with the bartender with a stranger
2,wp a space tourist on the iss becomes unable for some reason of ever surviving under earth gravity again
2,wp you re lead character designer on a fantasy video game and just presented the female armors to the client they smile cryptically and say that ll do perfectly you wake up the next morning to find out you are in the game as a female and actually have to survive wearing those skimpy armors
2,wp you buy a computer and are told that nobody has used this computer for a year it has an application that is just clickable up and down arrows you click each a few times but nothing seems to happen unbeknownst to you a previously rock steady stock market share starts changing at random
2,wp small town detective with anterograde amnesia starts investigating homicides in the area most clues lead to a dead end but over time this detective realizes a horrifying secret it was him all along yet he has no recollection of the murders
2,wp you are a prisoner condemned to die however the 2047 prison accords guarantee a last meal with no limitations or else you go free nobody wants you released your crime is too heinous but your last meal request is making them reconsider
2,wp a group of dragon hunter sent out to hunt for an exclusive and ravenous dragon what they don t know is that this would be their last hunt as the hunters becomes hunted and lightning mets poison
2,wp you a vagrant and wanderer are the best swordsmaster in the world and constantly have to fend off challengers and hopefuls who want to learn from you you are not the best because of raw skill however but because you cannot die no matter how much you wish you could
2,wp the adventure is over the dark lord is slain despite that you feel a twinge of sadness as you leave your party members no friends behind to return back to your ordinary life
2,wp on a bet a demon teen decides to try and summon a human the problem is that it worked and it summoned you
2,wp when the aliens came they immediately attacked they burned a molten chasm all the way to area 51 it was only until they extracted the broken body of one of their own out of that deep underground facility that we understood why we were on the wrong side the entire time
2,wp the dragon is keeping the knights safe by burning them alive it s a better fate than what the princess wants to do to them
2,wp two people who are close lovers close friends siblings or the like are each trying to keep the same important secret from each other
2,wp reincarnation is proven to be real by scientists and a service is created which can tell you all about your past lives you order it for you and your spouse for your tenth anniversary the results are troubling
2,wp the rest of the adventuring party has voted that you should have a talk with the bard he s loved by all but he was raised by harpies the party is tired of eating rat stew and the bards table manners are not for the faint of heart
2,wp sorry boss i can t come into work today my anime protagonist syndrome is flaring up again
2,wp the sun gets eminent domain d by the galactic council
2,wp dating one of the most powerful supers in the world is surprisingly easy not letting them find out you re actually a lot more powerful than they are? now that s hard
2,wp after meeting humans most aliens will voluntarily sign up for counselling sessions as an alien meeting a human for the first time your about to find out why
2,wp after the curse of immortality was put on you at first you loved it but now at the age of 1000 your starting to hate it
2,wp i ve adapted this robot to consume organic fuel and it can also repair its bio organs wounds over time isn t that basically just a human with extra steps? damn it
2,wp you have been tasked with writing a speech commemorating the 80th anniversary of the end of ww2 the axis powers won
2,wp you own a parrot and you talk in your sleep usually it s cool to hear the things you said in your sleep due to your parrot repeating them in the morning however one time it said something which sent chills down your spine
2,sp a blind woman and her service robot take an afternoon stroll around the park
2,wp in a fantasy anime world you run the only salon specializing in hair dye heroes villains demon lords and kings and queens all come to your store to get the principal character special dye job and as with any hair related profession these people tell you everything
2,wp a child has been gifted the power to have what they write become reality fortunately the child isn t very writing inclined so it s never known that is until a bad event occurs and they start writing horror stories to cope with the event which become reality for the people surrounding them
2,wp you ve been a shape shifter for years the first was spent doing a lot of adjusting the second and third were spent getting in the groove the entire time you struggled against government agents trying to catch and dissect you it s only recently that a super agency has been trying to help
2,wp you are a terrible liar you are a prophet you have a prophecy that will make the very dangerous person in front of you very very unhappy you have one chance to make your vision sound like a good thing
2,wp you design escape rooms for mages and are quite popular for it customers range from curious newbies to record setting professionals your latest challenge? design an escape room for the world s best magical escapist
2,wp the earth is under attack from aliens only a group of really rabid k pop fans can save the world from destruction
2,wp you are a supervillain however while other villains rob banks or try to take over the world you just go around annoying people
2,wp when the hero refuses to sacrifice their love interest to save the world and instead finds another method to do so they are pretty pleased with themselves the love interest however is furious
2,wp when a captured soldier takes one too many blows to the head while being tortured he begins to vividly hallucinate that he s in hell in order to escape his captors and get back home safe he has to quite literally face his demons
2,wp you re law enforcement in a world where those who break the law including children committing petty crimes are banished initially unbeknownst to you through a portal to another world you receive a call from a cinema about a child sneak in
2,wp you ve had this song stuck in your head for months now so you try to figure out what it is but even though everyone you ask seems to remember the tune they also don t know what song it comes from
2,wp an alien race losing an interstellar war and on the verge of extinction decides now is the time to unleash its superweapon traveling to planet earth it prepares to pick up its billions of genetic superweapons
2,wp you stand in the rain calling for a taxi an odd looking car pulls up and rolls down it s window you sigh in relief a voice from inside says welcome to the ixat that ll be 1 cent
2,wp desperate to escape the wizard used the last of their magic to turn into a tree they underestimated the slowness of a mind of wood however and awoke hundreds of years later in the modern age
2,wp i m sorry the hero apologized to the fallen villain what for? they grunted their eyes full of hate the hero with a solemn face admitted you were supposed to be the hero of the story and i the villain
2,wp in the midst of combat the villain watches in terror as the hero swallows an entire roast chicken and two cheese wheels at once
2,wp you are a witch in an era if interstellar travel your crew respects your practice and gives you time for your workings one day the ships computer asks you for information on witchcraft the next day the computer asks to take part in your next ritual
2,wp sure being an all powerful entity is great but nobody considered the physical transformation you would have to endure
2,wp while taking a walk through the park you inexplicably find yourself in a fantasy type world however here you discover that it is you who are the fantasy creature and disguising yourself is getting annoying
2,ip you didn t know your childhood house had a basement humans taste better in the dark https static paraloscuriosos
2,wp a dragon is powerful terrifying greedy and as you have discovered a surprisingly good friend
2,ip a centaur attempts to subdue a monster that happens to be her own tail an endless fight by isabell
2,eu take the kindest sweetest character of your favourite show drag them through another hellish universe then return them to their own show
2,wp turns out aliens do exist their favorite past time? driving conspiracy theorists insane by letting them see alternate dimensions where they are correct and posting their breakdowns to galaxytube
2,wp you re a doctor who can see into the future of all of your patients one day a child walks in gravely hurt but you see no future for them they won t die their future doesn t exist
2,wp the world s best assassin is a cat after all who can climb buildings land on their feet hear things and sneak around without anyone suspecting anything?
2,wp you re doing that human thing what human thing? that human thing where you see a deadly predator and go friend shaped come join my found family
2,wp reverse romeo and juliet two families have long been allies but their kids absolutely hate each other
2,wp while at work two tentacles sprout from you neck regardless you have to get your report written up by the end of the day
2,wp a random country is sent nearly 1000 years into the past without their technology being destroyed so their technology is super futuristic now they then have the country rise as the supreme country and are worshipped by everyone in the present
2,wp why does the king need a paladin to tutor his daughter? well he has many enemies you re not telling the whole truth are you? well she is the child by his dalliance with the dragon queen and the princess isn t getting along with the rest of the family
2,wp mankind has been extinct for four hundred million years but the inheritors have found a rich cache of genetic material from that period a zoo is developed complete with all the flora and fauna of the age including the apex predator homo sapiens welcome to cenozoic park
2,wp no one knows where they went but when elves returned to earth they expected to hold dominion over all as they once did however they were woefully unprepared for the technological advancements humans have made in their absence
2,wp since the first time you licked one of your wounds as a child you always loved the taste of blood today you live near a bar that serves a drink called virgin blood it looks smells and tastes like blood you thought the barman found a clever way to imitate blood perfectly until tonight
2,wp they are the kingdom s finest historian with meticulously kept records of the dark lord s rise and fall from power every battle every known speech even some accounts from within the dark lord s inner circle it s almost as if they were there the whole time
2,wp the first day you woke up being able to fly the day after invisibility was added every day a new power is added to all the others after 3 days you started using them for profit after 15 you started being a superhero but every day you are less of a hero less of a human more of a god
2,wp each empire has a special creature that everyone worships that gives the empire it s blessing and sometimes sends its own spawn into war to help the military commonly you hear of dragons manticores etc to be these creatures but the most feared empire is the egyptian empire with its cat
2,wp after saving his life the old blacksmith rewards you with a box when asked what s inside the blacksmith simply responds plot armour
2,wp as an exorcist you know the only reason why demons flee on reading the bible is because they hate it s writing quality and how mainstream it is but this demon seems to hate fantasy novels so you decided to quote some of them
2,wp a politician gains the ability to perceive a black aura around anyone who plans to harm them
2,wp you are the night watchman for the smithsonian which is under renovation they recently brought in a thousands of years old sarcophagus during your midnight rounds you hear a loud crashing noise when you go to investigate you find the sarcophagus open and a figure emerges from the shadows
2,wp the heroes stand in shock as the evil mastermind lay dead at their feet by the gun shot of an ordinary citizen they look at the heroes confused have you never thought to just shoot them while they re monologuing?
2,wp a serial killer killing for his artistic view is in his living room listening to jazz drinking wine and listening to a crime podcast to his delight the episode was about him his joy was shortlived however because they re getting everything wrong and making him sound like a generic lunatic
