label,text
8,troubled blood i know jk rowling is way over hyped thanks to harry potter but i have just finished reading
8,what is your favorite book that you never see or hear mentioned? a book you loved that never seems
8,what do you think about reading while listening to music? personally when i just started reading listening to music
8,gillian flynn? i loved all three of her books and urge everyone to read them even if you aren
8,hi this is an appreciation post for the book you bring the distant near by mitali perkins i absolutely love
8,the r books book club selection ama for september is if we were villains by m l rio if you
8,when you read a book do you attach actors or other visual representations to the characters you re reading?
8,which book could you not finish and why? i ll start most of the time when i drop books
8,mother night by kurt vonnegut i just finished vonnegut s mother night and can t stop thinking about it first
8,any love in here for kristin lavransdatter? i am curious to see whether there s any love for kristin
8,how do you feel when a sequel is announced for a book that s been out for a long time?
8,the hollow places by t kingfisher one of the few truly chilling books i ve read now i will preface
8,older books often written from first person? i ve gotten heavily into reading this past year and i ve
8,define reasonable can maryland s new e book law help change the marketplace?
8,npr 50 favorite sci fi and fantasy books of the past decade
8,does anyone use bookbub instead of goodreads? i ve always gotten bookbub emails for discounted ebooks but i visited
8,what s a book you never really recommend to people because it s just too personal to you? i
8,i just read the time traveler s wife and i don t remember the last time i felt this distraught over a book
8,stephen king s on writing a memoir on myself the only thing i knew about this book is that stephen
8,simple questions august 17 2021 welcome readers have you ever wanted to ask something but you didn t feel like
8,i just finished the cemetery of forgotten books series what an amazing journey i ve seen many readers suggest the
8,a study in scarlet spoilers this post contains spoilers amp x200b a study in scarlet was a turning point both
8,station eleven ugh felt like i was reading multiple stories by the disjointed events in the story was it really
8,anyone else a fan of reading aloud with their s o or friends amp etc? used to do this
8,prijs der nederlandse letteren controversy the prijs der nederlandse letteren is the main dutch language award paying 40 000 the
8,is there an optimal amount of pages a person can read a day and still retain what they ve read?
8,picking up a book for fun positively affects verbal abilities a new study shows that the more people read any kind of fiction the better their language skills are likely to be
8,is there a moratorium on negative book reviews by media outlets? i am currently in a book club and
8,i lent a big chunk of my personal library to a family member over covid just got them back from her and it all smells heavily of perfume how do i get rid of the smell?
8,having trouble with pale fire i loved the foreword the poem and much of the initial commentary and i understand
8,the house in the cerulean sea my god what a book it s about a man in a society where
8,just finished the poison artist by jonathan moore i have been all over the map with this author i read
8,out of all the things i ve thrown away in life i really wish i would have kept all the
8,have you ever fallen in love with someone based on their auto biography? a friend gave me born a
8,kindle paperwhite? okay so i started reading a lot recently and i love it i esp love having physical
8,unpopular opinion i didn t like frank herbert s dune here is why warning spoilers so i just finished frank
8,hachette book group will acquire workman publishing for 240 million
8,roald dahl was he the original horror thriller writer for children? adults? i loved all the books and
8,question for owners of non kindle ebook readers hi team my husband accidentally broke my kindle and i m in
8,tips on reading with add hi i m trying to improve my reading skills as someone who was never the
8,i have a strange bias i first look for a review that despises a book or movie i love and
8,best bulb light for reading before sleep? also waking up after falling asleep then can t fall asleep for hours
8,the situation in afghanistan makes me think about the book not without my daughter by betty mahmoody my mom showed
8,reading too deep into books i m not a bookworm but i enjoy reading one of the biggest problems that
8,just finished the divine within selected essays from aldous huxley appreciating huxley s literary prowess for using great organization and
8,books on youtube anyone got any good recommendations for good youtubers based on book reviews and discussions? i m
8,why do you like james joyce? james joyce from my very brief reading of him is all about the
9,did this bob myers joke hurt kev too?
9,charania pair of rookies sacramento s davion mitchell and brooklyn s cam thomas have been named co mvps of 2021 nba summer league
9,kevin durant takes over in 2012 nba finals game 1 vs heat full classic game 6 12 12
9,lewenberg masai ujiri on his new title vice chairman is just sexy tweet https twitter com jlew 1050 status 14280638942
9,murphy masai ujiri on first convo with precious achiuwa his first word was finally my first word was you are mine now
9,jackie macmullan announces retirement from espn
9,highlight jokic carves up the clippers defense during the 3 1 comeback with this bullet pass breakdown by thinkingbasketball on youtube
9,do you think the warriors hamptons five will all make the hall of fame? do you think everyone on
9,lebron james s famous block assist steal dunk sequence in game 2 of the 2013 nba finals
9,lewenberg ujiri on direction of this young raps team we re going to develop these players amp we re going to find a way to win another championship here we re not going to sit here amp cry that players don t want to come here that s not what we re about i think we ve gotten past that
9,all 27 straight missed rockets 3 pointers during game 7 vs warriors espn
9,what would pat beverlys tweet be for every team? with his recent trades and tweets it got me thinking
9,kid at swaggy p s nick young s basketball camp crosses him up
9,who wins in a 7 game series between the 2021 bucks vs 2020 lakers? who wins in a 7
9,golden state eviscerates portland in game 4 of the 2017 first round series going on a 28 5 run in the first 6 minutes of the game for perhaps the quickest garbage time in playoff history
9,highlight max kellerman i want iguodala
9,begley dwayne bacon and aamir simms signed deals with the knicks yesterday per the nba transaction page
9,post game thread the sacramento kings blow out the boston celtics 100 67 to win the summer league championship sac
9,how did the rockets and specifically james harden not get any of these 9 very obvious foul calls in game 7 against the gsw? they all resulted in big momentum shifts for gsw blowing houston s lead
9,the best of luka doncic at the olympics
9,who s your teams fan favorite player current or all time? not the best player on the team everyone
9,javalee mcgee fine i ll do it myself 3 pointer
9,kd all of us naturally are underdogs got chips on our shoulders because it s hard to make it to this point
9,that jamario moon rebound
9,report spurs were open to discussing dejounte murray lonnie walker iv in a deal for sixers ben simmons
9,si james harden houston will always hold a special place in my heart i was disappointed in myself that i couldn t bring a championship there because that s what i put the jersey on for every single game but the community work really lets me see the impact i can have on the city
9,carmelo anthony says pistons promised to pick him no 2 overall in the 2003 nba draft
9,koreen our hope is we re playing at home that s the goal for us playing away set us back for a few years playing away another year would set us back five years ujiri
9,do you think marcus smart can be an all star? not talking about the next season necessarily but thought
9,reports timberwolves still trying to make ben simmons trade but will need third team https nba nbcsports com 2021 08
9,lewenberg ujiri asked about nba tampering investigation it s incredible how every nba team has a deal done by 6 02 all i know is i gave up my phone for investigation other than that i have no comment that s my comment
9,discussion who is the best non all star in the league at each position? there is an insane and
9,1993 michael jordan vs rookie shaquille o neal mj 61 points shaq 29 points 24 rebounds
9,jayson tatum on liangelo ball getting on an nba roster it s only right
9,kevin durant draymond green say warriors brass f ked it up full interview chips
9,highlight joel embiid with the ben simmons
9,2020 lakers were up at least 30 points in each of their series game 4 vs portland https www basketball
9,jason terry hits the clutch 3pt right over lebron to seal a 3 2 lead in the 2011 finals
9,tyler herro giving back to the city today in a back to school supplies drive at gibson park raf tyler a man of the city
9,patrick beverley s salary for the upcoming season 14 3m is more money than rajon rondo has ever made in a year in the nba
9,highlight durant with an absolute display of his bag
9,with the announcement of jackie mac s retirement from espn i think back to this wonderful piece on the 2014 spurs
9,highlight pelicans emulate the globetrotters in 3 straight possessions
9,1993 all star game highlights shaq larry johnson pippen mj and isiah thomas vs david robinson malone barkley drexler and stockton
9,charania 16 year nba veteran rasheed wallace a 2004 champion and four time all star has agreed to a deal to become a new assistant coach at university of memphis under penny hardaway sources tell theathletic stadium
9,giannis takes a stroll in acropolis and lets fans touch the finals mvp and larry o brien trophies
9,kevon looney plays great defense in golden state s game 3 win over houston in the 2018 wcf
9,dwight howard impersonates chuck shaq and shanon sharpe
9,anthony edwards working on his curry range
9,the other dream 2012 great documentary about lithuania fighting for independence getting funded by the grateful dead and ultimately winning bronze in their first ever basketball olympics appearance
9,kd on the happiest he s been as a professional basketball player
9,lebron james laughs at russell westbrook yelling they better double me down 29 points
9,chris finch on dlo and kat they ve seen their contemporaries having success devin booker s in the finals nikola jokic wins mvp these are guys who they feel they are every bit as good as if not better than or at one point have been better than in the league
9,smith brad stevens on his evaluation of players my first thought is how much did i fear them? that s part of how i evaluate players
9,in 2004 the utah jazz were fined for playing a skit that featured a karl malone impersonator mocking kobe bryant for his legal troubles
9,lakers clippers suns warriors jazz nuggets mavericks blazers do any of these teams miss the playoffs next season? i
9,ted lasso amp allen iverson talk about practice
9,steph curry has ranked in the 97th percentile or higher in points per shot attempt among nba guards for 10 straight seasons that s bonkers to put that in context kyrie amp dame have each done it just once in their careers
9,bruce brown 2020 21 highlights
9,lance stephenson blocks dwight howard but celebrates too early and forgets to rebound the ball
9,shapiro james harden on nets at full strength nobody can beat us
9,michael porter jr was assisted on 79 2 of his made fgs last season i saw a bunch of nuggets
9,for those of you who grew up watching the nba in the 90s was the lack of a constant score bug something you noticed during the game? did the viewing experience suffer without it?
9,former miami heat center meyers leonard visits the boca raton synagogue to do a basketball clinic with kids and seek forgiveness following saying an anti semitic slur in march
9,brandon knight says he s willing to do whatever it takes to end up on an nba roster i ll do whatever man i m at a point in my career where i just want to serve if a team brings me in and they want me to bring water tie a shoe whatever it is man
9,draymond how much did our argument against the clippers drive you to leave the warriors? kd it wasn t the argument it was the way everybody acted like it didn t happen steve kerr acted like it didn t happen bob myers tried to discipline you and think that would put the mask over everything
9,create a lineup that would go 1 81 in the regular season we ve seen the 82 0 challenges but
9,why the west has dominated for 20 years this is my theory for why the west has dominated the east
9,jrue holiday on game 7 of brooklyn series mentally it was draining again mentally its draining because i feel like you do everything you can to stop somebody and its not working kevin durant is pretty much like this is gonna sound weird mentally penetrating you
9,highlight rookie jokic with an absolutely spectacular dime
9,anthony edwards showing off his hops with a between the legs dunk
9,frank garza father of pistons draftee luka garza details what it s like to raise an nba athlete how he taught luka to shoot and what it s like seeing your son be drafted
9,kevin durant on leaving okc for gsw i felt like i was the absolute perfect fit with what you guys were doing and i knew my game reached a point where i needed to know what that looked like and i thought it was no brainer i would do that shit a million times i didn t second guess at all
9,draymond green and steve kerr react to lebron james recalling play with photographic memory
9,a glimpse of the chess match between lebron and draymond in the finals
9,cade cunningham on his love for pb amp j sandwiches when i was at montverde every meal had peanut butter and jelly it s all about taking the time out of your day to make one that s a juicy one you know what i m sayin i need to put some calories on
9,warriors c kevon looney gets owned by kid at his own camp
9,davion mitchell i ve kind of always been like the underdog especially coming to sacramento hearing that they re not a really good defensive team that kind of just turned me on like i really want to change the narrative i want to be a defensive team because defense wins championships
9,kevin durant on engaging with fans on social media at the end of the day i m only talking about basketball i m not dabbling into politics i m not telling how you should live i m not flexing my money or my power or none of that shit on you i m just literally talking about the game
9,basketball analytics hello so i m a pretty new and casual nba fan i ve only been following it since
10,edgar morin france s best known intellectual just celebrated his hundredth birthday and eight decades of an exceptional scientific career driven by a keen ambition to build bridges between disciplines
10,extinction sounds bad but given the sheer amount of agony on earth the value of extinction is an open question roger crisp oxford on extinction and future generations
10,why science isn t objective science can t be done without prejudging or assuming an ethical political or economic viewpoint value freedom is a myth
10,we cannot know that religious experiences are false we should never believe that they are real though
10,nineteenth century interpretations of thought and the claims of twenty first century science
10,despite the warped popular image of thoreau as an apolitical and misanthropic hermit he actively lived his philosophy he risked his neck helping slaves to freedom and pioneered an ethic of civil disobedience that both gandhi and mlk cited as a major influence
10,in aristotle s nicomachean ethics he gives a justification for acting virtuously that focuses on pleasures pains and the effect that acting virtuously can have on us long term
10,the philosophy of disco elysium psychoanalysis ideology and absurd modernism
10,in his critique of the pure mind kant questioned whether metaphysical judgments were possible objects are usually considered to exist on their own completely independent of whether subjects know them or not the board exists we believe even when no one notices or thinks about it
10,there are transparent monsters in the world on outcasts the evolution of morality and philosophy tragedies and more part 1
10,what happens when you put african philosophies at the centre of learning
10,how words translate to action the ramifications of covid 19 rhetoric
10,semiotics swiss linguist ferdinand de saussure s pioneering work in semiotics that shaped the landscape of the 20th century continental tradition birthing structuralism and deeply influencing everyone from sartre and lacan to derrida and foucault
10,content creation creator burnout and differentiating authentic art from inauthentic art using nietzsche s terms artist and anti artist
10,always sticking to your convictions sounds like a good thing but it isn t
10,freedom is essential for creativity and to say that great art is born of suffering is to credit the oppressors rather than the artists
10,in itself consciousness is non conceptual and ineffable it is simply this what is happening right here right now psychedelic experiences help us understand this jussi jylkk aau
10,yijing zhang translating aristotelian logic into chinese
10,consciousness memory and value on the moral value of phenomenal consciousness
10,the elements of moral philosophy on ethical egoism a critique
10,the pursuit to build a utopian society or economy to live in will result in creating a world we wouldn t want to live in there is no hope in creating ideal city as socrates described in book ii of the republic
10,consumerism marxist point of view
10,the maoist political subjectivity of the comrade as object as a possible antidote to mark fisher s concept of capitalist realism
10,the world is all that is the case on wittgenstein s awkward place in the philosophical canon
10,the masters game 1 nietzsche amp realpolitik on hegel and the purpose of war and conflict
10,learning to see a person really learning to see them is an endless task even more challenging and more fruitful than learning to see art david egan ox uoc on why looks aren t superficial
10,the ontological argument is insufficient for belief in god despite the fact that existence is indeed a predicate contrary to what kant argued it is only a second order predicate as frege argued meaning that existence cannot be a defining predicate
10,knowing what s good for you on the problem of recognizing the good life
10,five modes of scepticism sextus empiricus and the agrippan modes
10,democracy justice and equality in ancient greece historical and philosophical perspectives
10,moral offsetting why offsetting meat consumption is different from offsetting rape
10,logic from kant to russell laying the foundations for analytic philosophy
10,horizontal thinking a useful presentation of lateral thinking and logical reasoning
10,the forgotten father of roman stoicism cato the younger was a roman senator and stoic philosopher who made a career out of purity inevitably making him julius caesar s archnemesis and was the embodiment of virtue for seneca dante and george washington
10,the moral case for guest worker programmes
10,depression anxiety and aristotle s state of entelechy
10,philosophy in a different style
10,we cannot produce reasonable persons title altered
10,solutions for the practical problems of determinism
10,doki doki literature club a philosophical reflection into existential horror determinism free will and choice
10,there are no objective moral truths how not to argue for this claim
10,language form s of life and logic investigations after wittgenstein
10,the moral blindspot of first world nations
10,the impossibility of religious miracles
10,kant divided the human s ability to know into three parts sensibility understanding and reason according to him understanding works by categories
10,nietzsche s anti christ written just before his mental collapse in this provocative work nietzsche alleges christ s original message was already distorted in the new testament there was only one christian and he died on the cross
10,at the start of the nicomachean ethics aristotle looks at means and ends realizing that we usually pursue ends for the sake of yet another end aristotle finds happiness to be an end that we seek ultimately for itself
10,transhumanism as simplified humanism
10,despite being the greatest and most influential philosopher in history plato s biography is as much myth as history he was the son of apollo by his virgin mother was sold into slavery in sicily and studied with egyptian priests libyan mathematicians pythagoreans heracliteans and eleatics
10,conspiring with the enemy the ethic of cooperation in warfare
10,moral luck the difference between speeding and manslaughter
10,imagine there s no jealousy why we should understand jealousy as nothing more than a vice that ought to be replaced by the new virtue of compersion
10,in book ii of the republic for philosophical discourse glaucon takes up thrasymachus perspective against socrates that justice was created by the men who suffered an injustice at one point but then became powerful enough to dominate
10,the happiness of the fish taoism philosophy a small story from taoism philosopher zhuangzi a funny debate between zhuangzi and huizi on the bridge of the hao river
10,aristotle stresses the importance of forming habits of our virtuous actions and shows virtue to be the intermediate condition between an excess and a deficiency
10,georg simmel s philosophy of money
10,humanity will always find a way to justify exploitation
10,five lessons on bringing truth back to politics from britain s first female philosophy professor essay by the philosopher peter west durham university
10,the concealed influence of custom hume s treatise from the inside out
10,a restatement of expected comparative utility theory a new theory of rational choice under risk
10,the morality of euthanasia
10,why some of the smartest people can be so very stupid
10,wildfires and prison labor crisis continues to expose systemic inequity
10,nietzsche s god is dead is not a modernist comment on religion but a postmodernist warning that the modernist religion of science falls with this god and leaves us staring into the postmodernist abysses of relativism and nihilism
10,to cultivate success rather than simply exhaustion education must rediscover the role of leisure in learned discussion it must rediscover its roots in the schol
10,we are being sold a myth internalising the work ethic is not the gateway to a better life it is a trap john danaher nui on why you should hate your job
10,oc derrida amp disability outlining a crip hauntology
10,laughter is vital for philosopher henri bergson laughter solves a serious human conundrum how to keep our minds and social lives elastic
10,why pre reflective intuitions do not mean that free will is an illusion
10,abortion and the ending of life
10,the morality of suicide
10,the online hereafter a review of patrick stokes digital souls a philosophy of online death
10,human all too human a book for free spirits marks nietzsche s period as an independent philosopher and represents a monument of a crisis for him a critical turning point in his life and thought
10,why we should let people change their minds
10,binge watching robs us of an opportunity to cultivate our moral sensibilities no l carroll cuny on gossip morality and binge watching tv
10,utilitarian arguments during covid a symptom not the answer
10,animals are moral subjects without being moral agents we are morally obliged to grant them certain rights without suggesting they are morally equal to humans
10,r philosophy open discussion thread august 09 2021 welcome to this week s open discussion thread this thread is a
10,carl jung s concept of the collective unconscious is often misunderstood to be a collective hive consciousness but it was really a hypothesis about a mental counterpart to dna by which instinctual structures of the mind are inherited
10,the battle for fundamentality processes vs things
10,we only become a person when we gain consciousness james mahon cuny
